{
  "schema_version": 1,
  "site_name": "Global Digital Asset Radar",
  "jurisdictions": [
    {
      "id": "hk",
      "name": "Hong Kong",
      "config": "config/jurisdictions/hk.json",
      "status": {
        "watcher": "live",
        "analyst_verifier": "live",
        "seeded": true
      },
      "coverage_notes": "Founding jurisdiction. Live RSS watcher (SFC + HKMA feeds), live analyst/verifier via the scheduled CCR trigger, fully seeded."
    },
    {
      "id": "us",
      "name": "United States",
      "config": "config/jurisdictions/us.json",
      "status": {
        "watcher": "live",
        "analyst_verifier": "planned",
        "seeded": true
      },
      "coverage_notes": "Live RSS/HTML-diff/JSON-API watcher (SEC + CFTC + FinCEN + OCC + Federal Reserve + Federal Register feeds), seeded. Analyst/verifier automation not yet activated -- owner sign-off pending before the CCR trigger is extended to this jurisdiction."
    },
    {
      "id": "eu",
      "name": "European Union",
      "config": "config/jurisdictions/eu.json",
      "status": {
        "watcher": "live",
        "analyst_verifier": "planned",
        "seeded": true
      },
      "coverage_notes": "Live RSS watcher (European Commission + ESMA + EBA + ECB + AMLA feeds), seeded. Analyst/verifier automation not yet activated -- owner sign-off pending before the CCR trigger is extended to this jurisdiction."
    },
    {
      "id": "uk",
      "name": "United Kingdom",
      "config": "config/jurisdictions/uk.json",
      "status": {
        "watcher": "live",
        "analyst_verifier": "planned",
        "seeded": true
      },
      "coverage_notes": "Live RSS/Atom watcher (FCA + Bank of England + HM Treasury feeds), seeded. Analyst/verifier automation not yet activated -- owner sign-off pending before the CCR trigger is extended to this jurisdiction."
    },
    {
      "id": "sg",
      "name": "Singapore",
      "config": null,
      "status": {
        "watcher": "planned",
        "analyst_verifier": "planned",
        "seeded": false
      },
      "coverage_notes": "Planned. Ships as a manual-assisted watcher (no browser-UA impersonation), per owner decision."
    },
    {
      "id": "uae",
      "name": "United Arab Emirates",
      "config": null,
      "status": {
        "watcher": "planned",
        "analyst_verifier": "planned",
        "seeded": false
      },
      "coverage_notes": "Planned. Federal vs free-zone regulator scope to be settled in its build phase."
    },
    {
      "id": "ch",
      "name": "Switzerland",
      "config": "config/jurisdictions/ch.json",
      "status": {
        "watcher": "live",
        "analyst_verifier": "planned",
        "seeded": true
      },
      "coverage_notes": "Live RSS watcher (FINMA feed), seeded. Analyst/verifier automation not yet activated -- owner sign-off pending before the CCR trigger is extended to this jurisdiction."
    },
    {
      "id": "jp",
      "name": "Japan",
      "config": "config/jurisdictions/jp.json",
      "status": {
        "watcher": "live",
        "analyst_verifier": "planned",
        "seeded": true
      },
      "coverage_notes": "Live RSS watcher (FSA English + Japanese news feeds, JVCEA feed), seeded. Analyst/verifier automation not yet activated -- owner sign-off pending before the CCR trigger is extended to this jurisdiction."
    }
  ],
  "pillars": [
    {"id": "exchanges_vatp", "name": "Exchanges (VATP)"},
    {"id": "stablecoins", "name": "Stablecoins"},
    {"id": "dealing_custody_advisory", "name": "Dealing, Custody, Advisory & Management"},
    {"id": "tokenization_rwa", "name": "Tokenization & RWA"},
    {"id": "funds_etfs", "name": "Funds & ETFs"},
    {"id": "banking_money", "name": "Banking & Money"},
    {"id": "aml_cft_enforcement", "name": "AML/CFT & Enforcement"}
  ],
  "seal_vocabulary": {
    "in_force": "In force",
    "consultation_open": "Consultation open",
    "bill_pending": "Bill pending",
    "proposed": "Proposed",
    "no_dedicated_regime": "No dedicated regime"
  },
  "fetch_defaults": {
    "timeout_seconds": 15,
    "max_retries": 3,
    "backoff_base_seconds": 1.0,
    "backoff_multiplier": 2.0
  }
}
